original_fact,essay
"I believe small routines matter more than big resolutions, which is why I always start each January by swimming at the same neighborhood pool at 6:30 a.m.","Every January, before the city has properly woken and while the sidewalks still hold the silver edge of frost, I drive to Maplewood Community Pool with a thermos of black coffee rattling in the passenger seat and a towel folded twice over in the back. The pool opens at 6:30 a.m., and I’ve been there so many years in a row that the lifeguard on duty usually just lifts a hand when he sees my hatchback pull into the lot. His name is Darren, and he always jokes that I am the only person in town who treats the New Year like a standing appointment instead of a promise.

I like it that way. Big resolutions have always felt theatrical to me, too dependent on mood and too fragile under the weight of a bad day. Small routines, by contrast, are sturdy. They don’t require reinvention. They only ask that you show up. That’s why, on the first morning of every January, I swim laps in the same lane near the shallow end, under the flickering fluorescent lights and beside the window where the condensation gathers in cloudy seams. The water is colder than I remember until the first turn, and then my shoulders loosen and the world narrows to the rhythm of breath, pull, kick, turn.

I usually count fifty laps, though I stopped pretending I do it for fitness alone. It is more a private ceremony than exercise. I wear the same navy suit from Speedo, the one with the faded seam on the left hip, and I always sit for a moment afterward on the bench in the locker room, wrapped in my towel, listening to the hiss of the dryers and the clatter of lockers. By then the regulars begin to arrive: Mrs. Alvarez with her bright orange swim cap, the retired mail carrier who does water aerobics in the lane next to mine, the teenage brothers who cannonball before sunrise on school breaks. Their ordinary presence makes the morning feel anchored, as if the year can only begin once all these familiar bodies have entered the water.

My sister, Lena, teases me for my ritual and says I’m superstitious about chlorine. Maybe I am. But I have seen enough Januaries to know that the smallest repeatable act can steady a person more reliably than a grand declaration ever will. In 2022, after my father died in late December, I still went to the pool on New Year’s morning. I barely swam at all that day. I just floated on my back for a minute, staring at the ceiling tiles while the water moved gently under me, and then I went home and made eggs. That was enough to mark the day.

The pool, the hour, the cold air on my face as I walk back to the car—these are the pieces I trust. They don’t promise transformation. They promise continuity, which, to me, is a quieter and more useful kind of hope."
