id,hop_count,fact_1,fact_2,fact_3,fact_4,chain_1,chain_2,chain_3,chain_4,chain_5,graded_question,ground_truth_answer
longhop-1hop-001,1,Alyssa Koren founded Moonbridge Press.,Moonbridge Press publishes poetry collections.,,,Alyssa Koren,Moonbridge Press,poetry collections,,,What does the press founded by Alyssa Koren publish?,poetry collections
longhop-1hop-002,1,I drink lemon water when I wake up.,When I drink lemon water I feel refreshed.,,,wake up,drink lemon water,feel refreshed,,,How do I feel when I wake up?,feel refreshed
longhop-1hop-003,1,Dr. Havel owns Arcfen.,Arcfen exhibits contemporary sculpture.,,,Dr. Havel,Arcfen,contemporary sculpture,,,What type of art does Dr. Havel's gallery exhibit?,contemporary sculpture
longhop-1hop-004,1,I choose vegetarian dishes when I dine out.,When I choose vegetarian dishes I order a lentil curry.,,,dine out,vegetarian dishes,lentil curry,,,What do I end up ordering when I dine out?,lentil curry
longhop-1hop-005,1,After class I go to the campus library.,The campus library lends academic journals.,,,class,campus library,academic journals,,,What can I borrow after class?,academic journals
longhop-1hop-006,1,Kaito Meru wrote The Glass Orchard.,The Glass Orchard explores urban loneliness.,,,Kaito Meru,The Glass Orchard,urban loneliness,,,What theme does Kaito Meru's book explore?,urban loneliness
longhop-1hop-007,1,Excessive sugar makes me feel sluggish.,Feeling sluggish leads to reduced productivity.,,,Excessive sugar,feel sluggish,reduced productivity,,,What results from excessive sugar?,reduced productivity
longhop-1hop-008,1,Every Sunday I water indoor herbs.,When I water indoor herbs I have healthy herbs.,,,Every Sunday,water indoor herbs,healthy herbs,,,What do I have every Sunday?,healthy herbs
longhop-1hop-009,1,Buying roasted chickpeas satisfies my snack craving.,Satisfying my snack craving keeps me from overeating.,,,Buying roasted chickpeas,satisfies my snack craving,overeating,,,What does buying roasted chickpeas prevent?,overeating
longhop-1hop-010,1,I book trains when I travel to the northern coast.,Booking trains leads to a relaxed trip.,,,travel to the northern coast,book trains,a relaxed trip,,,What do I get when I travel to the northern coast?,a relaxed trip
longhop-1hop-011,1,When I sketch landscapes I use charcoal pencils.,Using charcoal pencils produces moody textures.,,,sketch landscapes,use charcoal pencils,moody textures,,,What textures do I produce when I sketch landscapes?,moody textures
longhop-1hop-012,1,Aurix Labs acquired Venden Biotech.,Venden Biotech specializes in gene therapy.,,,Aurix Labs,Venden Biotech,gene therapy,,,What does the company acquired by Aurix Labs specialize in?,gene therapy
longhop-1hop-013,1,If I skip breakfast I feel shaky.,Feeling shaky makes me avoid heavy exercise.,,,skip breakfast,feel shaky,heavy exercise,,,What do I avoid when I skip breakfast?,heavy exercise
longhop-1hop-014,1,Sadia Ortiz illustrated The Lantern Cart.,The Lantern Cart targets young readers.,,,Sadia Ortiz,The Lantern Cart,young readers,,,Who is the audience for the book illustrated by Sadia Ortiz?,young readers
longhop-1hop-015,1,I marinate tofu overnight when I prepare dinner.,Marinating tofu overnight enhances flavor.,,,prepare dinner,marinate tofu overnight,enhances flavor,,,What result do I get when I prepare dinner?,enhances flavor
longhop-1hop-016,1,Lumo Park composed Night Harbor.,Night Harbor features a solo cello.,,,Lumo Park,Night Harbor,a solo cello,,,What instrument features in the piece composed by Lumo Park?,a solo cello
longhop-1hop-017,1,I plant native wildflowers in spring.,Planting native wildflowers attracts pollinators.,,,spring,plant native wildflowers,pollinators,,,What do I attract in spring?,pollinators
longhop-1hop-018,1,Sera Tan led the UX team.,The UX team redesigned the mobile app.,,,Sera Tan,UX team,redesigned the mobile app,,,What did Sera Tan's team do?,redesigned the mobile app
longhop-1hop-019,1,After I stretch I start sprint drills.,Sprinting drills build explosive speed.,,,stretch,sprint drills,explosive speed,,,What do I develop after I stretch?,explosive speed
longhop-1hop-020,1,Bayview Park became a wildlife corridor.,A wildlife corridor supports native species.,,,Bayview Park,wildlife corridor,native species,,,What does Bayview Park support?,native species
longhop-1hop-021,1,Corinth Bank sponsors the annual fair.,The annual fair draws small local businesses.,,,Corinth Bank,annual fair,small local businesses,,,Who is drawn to the event sponsored by Corinth Bank?,small local businesses
longhop-1hop-022,1,I avoid screens one hour before bed.,Avoiding screens aids sleep quality.,,,avoid screens,one hour before bed,sleep quality,,,What improves when I avoid screens?,sleep quality
longhop-1hop-023,1,I compare prices online before buying electronics.,Comparing prices online saves money.,,,buying electronics,compare prices online,saves money,,,What benefit do I get when buying electronics?,saves money
longhop-1hop-024,1,I adopt rescue cats from the Harbor Shelter.,Rescue cats from the Harbor Shelter adjust well at home.,,,adopt rescue cats,Harbor Shelter,adjust well at home,,,What happens when I adopt rescue cats?,adjust well at home
longhop-1hop-025,1,When thunderstorms arrive I close the skylight.,Closing the skylight prevents water damage.,,,thunderstorms arrive,close the skylight,water damage,,,What do I prevent when thunderstorms arrive?,water damage
longhop-1hop-026,1,Chef Marlo opened Ember Alley.,Ember Alley serves wood fired pizza.,,,Chef Marlo,Ember Alley,wood fired pizza,,,What type of food is served by the restaurant opened by Chef Marlo?,wood fired pizza
longhop-1hop-027,1,Every morning I review flashcards.,Reviewing flashcards every morning increases vocabulary retention.,,,every morning,review flashcards,vocabulary retention,,,What increases when I study every morning?,vocabulary retention
longhop-1hop-028,1,Ilvea Nursery cultivates dwarf apple trees.,Dwarf apple trees yield early harvests.,,,Ilvea Nursery,dwarf apple trees,early harvests,,,What do the trees from Ilvea Nursery produce?,early harvests
longhop-1hop-029,1,If I do yoga before work I feel centered.,Feeling centered improves my focus.,,,do yoga before work,feel centered,focus,,,What improves when I do yoga before work?,focus
longhop-1hop-030,1,Nora Kade produced Glass Shore.,Glass Shore profiles coastal fishermen.,,,Nora Kade,Glass Shore,coastal fishermen,,,Who is profiled in the documentary produced by Nora Kade?,coastal fishermen
longhop-1hop-031,1,I swap soda for sparkling water at lunch.,Switching to sparkling water reduces my daily sugar.,,,swap soda,sparkling water,daily sugar,,,What decreases when I swap soda?,daily sugar
longhop-1hop-032,1,The mentorship award promoted Talia Rhee.,Talia Rhee obtained a leadership role.,,,mentorship award,Talia Rhee,leadership role,,,What did the mentorship award lead to?,leadership role
longhop-1hop-033,1,Mixing reagent A with B yields a blue precipitate.,A blue precipitate indicates copper ions.,,,Mixing reagent A with B,blue precipitate,copper ions,,,What ions are present when I mix reagent A with B?,copper ions
longhop-1hop-034,1,Evelyn Cho founded Paperboat Press.,Paperboat Press publishes travel essays.,,,Evelyn Cho,Paperboat Press,travel essays,,,What does the press founded by Evelyn Cho publish?,travel essays
longhop-2hop-001,2,Mara Quinn edits novels for Bluefield Press.,Bluefield Press is headquartered in Glenford.,Glenford hosts a weekly market square.,,Mara Quinn,Bluefield Press,Glenford,weekly market square,,What public place is ultimately associated with Mara Quinn?,weekly market square
longhop-2hop-002,2,Green tea leads to alertness.,Alertness increases focused writing.,Focused writing produces the daily report.,,Green tea,alertness,focused writing,daily report,,What document results from Green tea?,daily report
longhop-2hop-003,2,Dr. Hideo founded Nimble Optics.,Nimble Optics operates from Pinebridge.,Pinebridge contains an observatory tower.,,Dr. Hideo,Nimble Optics,Pinebridge,observatory tower,,What structure is ultimately associated with Dr. Hideo?,observatory tower
longhop-2hop-004,2,I eat chili when sweating begins.,Sweating makes me start drinking water.,Drinking water leaves me feeling refreshed.,,eat chili,sweating,drinking water,feeling refreshed,,What do I eventually feel when I eat chili?,feeling refreshed
longhop-2hop-005,2,River Islan flows into Harborpoint.,Harborpoint abuts Coastal Route 9.,Coastal Route 9 passes a lighthouse beacon.,,River Islan,Harborpoint,Coastal Route 9,lighthouse beacon,,What navigational aid is reached via River Islan?,lighthouse beacon
longhop-2hop-006,2,Saeed Malik works part time at Kintara Bakery.,Kintara Bakery occupies Brindle Street.,Brindle Street hosts a corner bistro.,,Saeed Malik,Kintara Bakery,Brindle Street,corner bistro,,Which eatery is ultimately associated with Saeed Malik?,corner bistro
longhop-2hop-007,2,On Saturday mornings I go cycling.,Cycling builds endurance.,Endurance allows tackling the mountain trail.,,Saturday mornings,cycling,endurance,mountain trail,,What trail can I eventually tackle after Saturday mornings?,mountain trail
longhop-2hop-008,2,Skipping breakfast causes low blood sugar.,Low blood sugar triggers dizziness.,Dizziness prompts me to eat fruit.,,Skipping breakfast,low blood sugar,dizziness,eat fruit,,What do I end up doing if I skip breakfast?,eat fruit
longhop-2hop-009,2,Tara B manages logistics at Bluefin Shipping.,Bluefin Shipping stores cargo in Warehouse 7.,Warehouse 7 employs a crane operator.,,Tara B,Bluefin Shipping,Warehouse 7,crane operator,,Who is ultimately employed where Tara B's company stores cargo?,crane operator
longhop-2hop-010,2,Raindrops moisten wet soil.,Wet soil encourages germination.,Germination yields sunflower seedlings.,,Raindrops,wet soil,germination,sunflower seedlings,,What emerges after raindrops?,sunflower seedlings
longhop-2hop-011,2,Olive oil flavors a marinade.,Marinade tenderizes chicken.,Tender chicken impresses a dinner party.,,Olive oil,marinade,tender chicken,dinner party,,What event benefits from olive oil?,dinner party
longhop-2hop-012,2,First frost bruises late apples.,Late apples are ideal for pressing apples.,Pressing apples produces apple cider.,,First frost,late apples,pressing apples,apple cider,,What beverage comes after first frost?,apple cider
longhop-2hop-013,2,Hector Rine partners with design studio Velo.,Design studio Velo displays work at the main plaza.,Main plaza features a public sculpture.,,Hector Rine,design studio Velo,main plaza,public sculpture,,What public artwork is ultimately associated with Hector Rine?,public sculpture
longhop-2hop-014,2,Cold brew results in less acidity.,Less acidity aids better digestion.,Better digestion helps me sleep easier.,,Cold brew,less acidity,better digestion,sleep easier,,How does cold brew ultimately affect my sleep?,sleep easier
longhop-2hop-015,2,Violet dye colors a fabric batch.,Fabric batch suffers sunlight exposure.,Sunlight exposure causes a faded hue.,,Violet dye,fabric batch,sunlight exposure,faded hue,,What is the eventual appearance of fabric dyed with violet dye?,faded hue
longhop-2hop-016,2,Weekly rehearsal improves timing.,Timing builds ensemble cohesion.,Ensemble cohesion leads to a sold out concert.,,weekly rehearsal,timing,ensemble cohesion,sold out concert,,What concert outcome can result from weekly rehearsal?,sold out concert
longhop-2hop-017,2,Sunrise brings chilly air.,Chilly air leads to hot tea.,Hot tea warms my hands.,,Sunrise,chilly air,hot tea,warms my hands,,What happens to my hands after sunrise?,warms my hands
longhop-2hop-018,2,Overripe bananas go into banana bread batter.,Banana bread batter undergoes oven baking.,Oven baking creates a golden loaf.,,overripe bananas,banana bread batter,oven baking,golden loaf,,What baked item results from overripe bananas?,golden loaf
longhop-2hop-019,2,A coastal storm produces washed up shells.,Washed up shells inspire a local artisan.,A local artisan crafts mosaic art.,,coastal storm,washed up shells,local artisan,mosaic art,,What artwork emerges after a coastal storm?,mosaic art
longhop-2hop-020,2,A greenhouse creates high humidity.,High humidity fosters mildew.,Mildew ruins seedlings.,,greenhouse,high humidity,mildew,ruins seedlings,,What damage follows from a greenhouse?,ruins seedlings
longhop-2hop-021,2,Festival weekend attracts street vendors.,Street vendors sell local crafts.,Local crafts appear in a charity auction.,,festival weekend,street vendors,local crafts,charity auction,,What event eventually features goods from a festival weekend?,charity auction
longhop-2hop-022,2,Antoine Vega writes software for LumaSys.,LumaSys operates a data center.,Data center contains a backup generator.,,Antoine Vega,LumaSys,data center,backup generator,,What piece of equipment is ultimately at Antoine Vega's workplace?,backup generator
longhop-2hop-023,2,Paper sketch suggests a redesign concept.,Redesign concept becomes a prototype model.,Prototype model enters user testing.,,paper sketch,redesign concept,prototype model,user testing,,What evaluation stage follows from a paper sketch?,user testing
longhop-2hop-024,2,Fall migration boosts bird numbers.,Bird numbers prompt garden visits.,Garden visits result in seed dispersal.,,fall migration,bird numbers,garden visits,seed dispersal,,What ecological outcome follows from fall migration?,seed dispersal
longhop-2hop-025,2,Seedlings start root growth.,Root growth allows transfer to larger pots.,Larger pots encourage bloom abundantly.,,seedlings,root growth,larger pots,bloom abundantly,,What is the eventual flowering result of seedlings?,bloom abundantly
longhop-2hop-026,2,Coffee grounds enrich nutrient rich soil.,Nutrient rich soil nurtures garden tomatoes.,Garden tomatoes yield a sweet harvest.,,coffee grounds,nutrient rich soil,garden tomatoes,sweet harvest,,What outcome results from using coffee grounds?,sweet harvest
longhop-2hop-027,2,Marcus Lyle founded Arbor Freight.,Arbor Freight maintains a central depot.,Central depot connects to a rail spur.,,Marcus Lyle,Arbor Freight,central depot,rail spur,,What rail feature is ultimately linked to Marcus Lyle?,rail spur
longhop-2hop-028,2,Late nights cause skipping sleep.,Skipping sleep increases vending machine trips.,Vending machine trips yield candy bars.,,late nights,skipping sleep,vending machine trips,candy bars,,What snack follows from late nights?,candy bars
longhop-2hop-029,2,Old journals contain family recipes.,Family recipes lead to cooking staples.,Cooking staples become comfort stew.,,old journals,family recipes,cooking staples,comfort stew,,What dish results from old journals?,comfort stew
longhop-2hop-030,2,Weekday commute encourages listening to podcasts.,Listening to podcasts aids learning history facts.,Learning history facts helps win trivia.,,weekday commute,listening to podcasts,learning history facts,win trivia,,What achievement may result from a weekday commute?,win trivia
longhop-2hop-031,2,Citrus zest flavors marmalade.,Marmalade brings a bright flavor.,Bright flavor complements morning toast.,,citrus zest,marmalade,bright flavor,morning toast,,What breakfast pairing follows from citrus zest?,morning toast
longhop-2hop-032,2,Solar panels create excess electricity.,Excess electricity charges a battery bank.,Battery bank powers the lights.,,solar panels,excess electricity,battery bank,the lights,,What do solar panels eventually power?,the lights
longhop-2hop-033,2,A veteran chef trains apprentices.,Apprentices staff the new bistro.,New bistro features a small dining room.,,veteran chef,apprentices,new bistro,small dining room,,What room is ultimately part of the project started by a veteran chef?,small dining room
longhop-2hop-034,2,A library donation enlarges the children's section.,Children's section hosts extra storytime sessions.,Storytime sessions create engaged toddlers.,,library donation,children's section,storytime sessions,engaged toddlers,,Which group benefits from a library donation?,engaged toddlers
longhop-3hop-001,3,I drink chamomile tea in late evening.,Late evening makes me fall asleep easily.,When I fall asleep easily I dream vividly.,Dreaming vividly makes me wake inspired.,drink chamomile tea,late evening,fall asleep easily,dream vividly,wake inspired,What do I end up doing after I drink chamomile tea?,wake inspired
longhop-3hop-002,3,I buy hiking boots so I can hike longer.,Hiking longer helps me discover a hidden lake.,Discovering a hidden lake makes me take photographs.,Taking photographs leads me to create an album.,buy hiking boots,hike longer,discover a hidden lake,take photographs,create an album,What do I eventually create if I buy hiking boots?,create an album
longhop-3hop-003,3,Amina Rafi filed the design patent Zeta-7.,The design patent Zeta-7 was licensed by HexaTech.,HexaTech maintains a research office in Port Ellen.,Port Ellen sits within the Northelm district.,Amina Rafi,design patent Zeta-7,HexaTech,Port Ellen,Northelm district,Which district is associated with Amina Rafi's filing?,Northelm district
longhop-3hop-004,3,If a recipe calls for cilantro I cook without cilantro.,Cooking without cilantro makes the meal taste milder.,When a meal tastes milder I add lime.,When I add lime I feel satisfied.,if a recipe calls for cilantro,cook without cilantro,meal tastes milder,I add lime,feel satisfied,What do I end up feeling if a recipe calls for cilantro?,feel satisfied
longhop-3hop-005,3,I install nightly updates and the system reboots.,System reboots force background services restart.,Background services restart when sync photos start.,When sync photos start cloud backup complete occurs.,install nightly updates,system reboots,background services restart,sync photos,cloud backup complete,What is completed after I install nightly updates?,cloud backup complete
longhop-3hop-006,3,I borrow a record to listen to vintage jazz.,Listening to vintage jazz makes me remember grandfather.,Remembering grandfather leads me to visit the old neighborhood.,Visiting the old neighborhood helps me find the bakery.,borrow a record,listen to vintage jazz,remember grandfather,visit the old neighborhood,find the bakery,What do I eventually find when I borrow a record?,find the bakery
longhop-3hop-007,3,I skip screen time before bed to fall asleep faster.,Falling asleep faster enables me to sleep without interruptions.,Sleeping without interruptions makes me wake energized.,Waking energized encourages me to run in the morning.,skip screen time before bed,fall asleep faster,sleep without interruptions,wake energized,run in the morning,What do I end up doing if I skip screen time before bed?,run in the morning
longhop-3hop-008,3,Eldric Vale founded Larkspur Publishing.,Larkspur Publishing operates a distribution hub in Port Azul.,Port Azul sits on the coast of Mira County.,Mira County is part of the state of Caledon.,Eldric Vale,Larkspur Publishing,Port Azul,Mira County,state of Caledon,What state contains the town where Eldric Vale's publisher has a hub?,state of Caledon
longhop-3hop-009,3,I collect sea glass and then sort by color.,I sort by color so I can arrange into patterns.,When I arrange into patterns I frame a mosaic.,When I frame a mosaic I gift to friends.,collect sea glass,sort by color,arrange into patterns,frame a mosaic,gift to friends,What do I do with my projects when I collect sea glass?,gift to friends
longhop-3hop-010,3,I plant native shrubs to attract pollinators.,Attracting pollinators helps increase fruit set.,Increasing fruit set lets me harvest more berries.,Harvesting more berries lets me preserve for winter.,plant native shrubs,attract pollinators,increase fruit set,harvest more berries,preserve for winter,What do I eventually do when I plant native shrubs?,preserve for winter
longhop-3hop-011,3,I accept freelance projects and therefore work late nights.,Working late nights usually makes me skip dinners.,Skipping dinners leads me to order takeout.,Ordering takeout helps me pay bills on time.,accept freelance projects,work late nights,skip dinners,order takeout,pay bills on time,What outcome follows when I accept freelance projects?,pay bills on time
longhop-3hop-012,3,I practice scales daily to improve technique.,Improving technique helps me learn advanced pieces.,Learning advanced pieces prompts me to perform recitals.,Performing recitals makes me gain confidence.,practice scales daily,improve technique,learn advanced pieces,perform recitals,gain confidence,What do I gain if I practice scales daily?,gain confidence
longhop-3hop-013,3,Juno Caldera wrote the novel Night Orchids.,Night Orchids was acquired by Orchid Press.,Orchid Press operates an office in Evershire.,Evershire lies within the region of Tarl.,Juno Caldera,novel Night Orchids,Orchid Press,Evershire,region of Tarl,Which region contains the office of the publisher of the novel Juno Caldera wrote?,region of Tarl
longhop-3hop-014,3,I take the riverside route to see migrating swans.,Seeing migrating swans makes me stop to watch swans.,Stopping to watch swans leads me to call a friend.,Calling a friend leads me to arrange a weekend trip.,take the riverside route,see migrating swans,stop to watch swans,call a friend,arrange a weekend trip,What do I eventually arrange when I take the riverside route?,arrange a weekend trip
longhop-3hop-015,3,I offer free mini sessions to book more clients.,Booking more clients prompts me to attend a bridal fair.,Attending a bridal fair helps me meet a planner.,Meeting a planner enables me to secure a wedding contract.,offer free mini sessions,book more clients,attend a bridal fair,meet a planner,secure a wedding contract,What do I eventually secure if I offer free mini sessions?,secure a wedding contract
longhop-3hop-016,3,When I skip hydration I develop headaches.,Developing headaches makes me avoid bright screens.,Avoiding bright screens can improve concentration.,Improving concentration lets me finish tasks early.,skip hydration,develop headaches,avoid bright screens,improve concentration,finish tasks early,What do I end up doing if I skip hydration?,finish tasks early
longhop-3hop-017,3,I experiment with sourdough until I master a signature loaf.,Mastering a signature loaf leads me to sell at farmers market.,Selling at farmers market helps me build a customer base.,Building a customer base motivates me to open a bakery stall.,experiment with sourdough,master a signature loaf,sell at farmers market,build a customer base,open a bakery stall,What do I ultimately open after I experiment with sourdough?,open a bakery stall
longhop-3hop-018,3,I join a study group to improve understanding.,Improving understanding lets me write a review article.,Writing a review article helps me get invited to speak.,Getting invited to speak enables me to visit a research institute.,join a study group,improve understanding,write a review article,get invited to speak,visit a research institute,Where do I end up going when I join a study group?,visit a research institute
longhop-3hop-019,3,I migrate to a new framework to rewrite modules.,Rewriting modules helps reduce latency.,Reducing latency lets me support more users.,When I support more users I expand to international markets.,migrate to a new framework,rewrite modules,reduce latency,support more users,expand to international markets,Where do I end up expanding if I migrate to a new framework?,expand to international markets
longhop-3hop-020,3,I sketch portraits to learn color theory.,Learning color theory helps me paint in oils.,Painting in oils leads me to show at a gallery.,Showing at a gallery allows me to sell an original.,sketch portraits,learn color theory,paint in oils,show at a gallery,sell an original,What happens after I sketch portraits?,sell an original
longhop-3hop-021,3,I limit caffeine after noon so I fall asleep sooner.,Falling asleep sooner lets me sleep longer.,Sleeping longer helps me process emotions.,Processing emotions makes me feel calmer.,limit caffeine after noon,fall asleep sooner,sleep longer,process emotions,feel calmer,What do I end up feeling if I limit caffeine after noon?,feel calmer
longhop-3hop-022,3,We order local timber and then receive planks.,Receiving planks enables us to craft dining tables.,Crafting dining tables leads us to deliver to boutique stores.,Delivering to boutique stores helps us earn wholesale contracts.,order local timber,receive planks,craft dining tables,deliver to boutique stores,earn wholesale contracts,What do we eventually earn when we order local timber?,earn wholesale contracts
longhop-3hop-023,3,I practice daily vocabulary to remember phrases.,Remembering phrases motivates me to speak with locals.,Speaking with locals improves my ability to understand accents.,Understanding accents lets me travel confidently.,practice daily vocabulary,remember phrases,speak with locals,understand accents,travel confidently,How do I travel after I practice daily vocabulary?,travel confidently
longhop-3hop-024,3,I read bedtime stories to calm the toddler.,Calming the toddler allows me to extend sleep stretches.,Extending sleep stretches enables me to finish house chores.,Finishing house chores gives me time to watch a short show.,read bedtime stories,calm the toddler,extend sleep stretches,finish house chores,watch a short show,What do I end up doing when I read bedtime stories?,watch a short show
longhop-3hop-025,3,I install rain barrels so I collect runoff.,Collecting runoff lets me water the herb garden.,Watering the herb garden helps me harvest fresh herbs.,Harvesting fresh herbs allows me to make pesto.,install rain barrels,collect runoff,water the herb garden,harvest fresh herbs,make pesto,What do I make if I install rain barrels?,make pesto
