id,hop_count,fact_1,fact_2,fact_3,fact_4,chain_1,chain_2,chain_3,chain_4,chain_5,graded_question,ground_truth_answer
longhop-3hop-026,3,I post weekly tutorials to gain followers.,Gaining followers leads me to receive interview requests.,Receiving interview requests leads me to appear on a podcast.,Appearing on a podcast helps me reach a new audience.,post weekly tutorials,gain followers,receive interview requests,appear on a podcast,reach a new audience,What audience do I reach after I post weekly tutorials?,reach a new audience
longhop-3hop-027,3,I approve cycling lanes so more people cycle.,More people cycle prompts entrepreneurs to open bike shops.,Opening bike shops pushes owners to stock repair kits.,When shops stock repair kits cyclists join weekend cycling clubs.,approve cycling lanes,more people cycle,open bike shops,stock repair kits,join weekend cycling clubs,What do cyclists do after I approve cycling lanes?,join weekend cycling clubs
longhop-3hop-028,3,I curate local bands to program diverse sets.,Programming diverse sets helps attract wider crowds.,Attracting wider crowds helps secure sponsorships.,Securing sponsorships helps fund next year's festival.,curate local bands,program diverse sets,attract wider crowds,secure sponsorships,fund next year's festival,What happens to the festival funding if I curate local bands?,fund next year's festival
longhop-3hop-029,3,I adopt a senior dog and then visit the vet weekly.,Visiting the vet weekly helps me titrate medication.,Titrating medication helps improve mobility.,When we improve mobility we enjoy evening walks.,adopt a senior dog,visiting the vet weekly,titrate medication,improve mobility,enjoy evening walks,What do I end up enjoying after I adopt a senior dog?,enjoy evening walks
longhop-3hop-030,3,I schedule weekly therapy to reflect on patterns.,Reflecting on patterns leads me to practice grounding exercises.,Practicing grounding exercises helps reduce panic episodes.,Reducing panic episodes encourages me to resume social activities.,schedule weekly therapy,reflect on patterns,practice grounding exercises,reduce panic episodes,resume social activities,What do I eventually do when I schedule weekly therapy?,resume social activities
longhop-3hop-031,3,I complete a coding bootcamp and then build several projects.,Building several projects leads me to publish a portfolio website.,Publishing a portfolio website helps me receive interview offers.,Receiving interview offers allows me to accept a developer role.,complete a coding bootcamp,build several projects,publish a portfolio website,receive interview offers,accept a developer role,What position do I accept after I complete a coding bootcamp?,accept a developer role
longhop-3hop-032,3,I submit a short film hoping the film is selected.,When the film is selected the film will screen at an indie festival.,When films screen at an indie festival meeting distributors becomes possible.,Meeting distributors enables me to negotiate a distribution deal.,submit a short film,film is selected,screen at an indie festival,meeting distributors,negotiate a distribution deal,What deal do I seek after I submit a short film?,negotiate a distribution deal
longhop-3hop-033,3,I organize a bake sale for raising donations.,Raising donations encourages me to book a community hall.,Booking a community hall allows me to invite local bands.,Inviting local bands helps me host a fundraiser.,organize a bake sale,raising donations,book a community hall,invite local bands,host a fundraiser,What do I host when I organize a bake sale?,host a fundraiser
longhop-3hop-034,3,I practice free throws to increase accuracy.,Increasing accuracy helps me score more points.,Scoring more points helps me win clutch games.,Winning clutch games lets me earn a trophy.,practice free throws,increase accuracy,score more points,win clutch games,earn a trophy,What prize do I hope to earn if I practice free throws?,earn a trophy
